{
  "version": "0.9.0",
  "updatedAt": "2026-10-04T10:30:00.000Z",
  "model": "dependency-aware-continuous-build-graph",
  "nodes": [
    {
      "id": "repo-foundation",
      "name": "Single repository foundation + governance",
      "family": "foundation",
      "dependencies": [],
      "status": "DONE",
      "requirements": [
        "REQ-REPO-001",
        "REQ-GOV-001"
      ],
      "files": [
        "package.json",
        "tsconfig.base.json",
        "README.md",
        "SECURITY.md",
        "CLAUDE.md",
        "LICENSE",
        ".gitignore"
      ],
      "tests": [],
      "commits": [],
      "review": {}
    },
    {
      "id": "core-types",
      "name": "Shared core domain types (@uaap/core)",
      "family": "core",
      "dependencies": [
        "repo-foundation"
      ],
      "status": "DONE",
      "requirements": [
        "REQ-CORE-001"
      ],
      "files": [
        "packages/core/src/enums.ts",
        "packages/core/src/types.ts",
        "packages/core/src/ids.ts"
      ],
      "tests": [],
      "commits": [],
      "review": {}
    },
    {
      "id": "trust-kernel",
      "name": "Fail-closed Authorization / Trust Kernel",
      "family": "trust-kernel",
      "dependencies": [
        "core-types"
      ],
      "status": "DONE",
      "requirements": [
        "REQ-SEC-TRUSTKERNEL-001",
        "REQ-SEC-FAILCLOSED-001"
      ],
      "files": [
        "packages/authorization-kernel/src/index.ts"
      ],
      "tests": [
        "packages/authorization-kernel/test/kernel.test.ts"
      ],
      "commits": [],
      "review": {}
    },
    {
      "id": "policy-engine",
      "name": "Policy-as-code engine (schema-validated, fail-closed)",
      "family": "policy",
      "dependencies": [
        "core-types"
      ],
      "status": "DONE",
      "requirements": [
        "REQ-SEC-POLICY-001"
      ],
      "files": [
        "packages/policy-engine/src/index.ts",
        "policies/baseline.policy.json",
        "schemas/policy.schema.json"
      ],
      "tests": [
        "packages/policy-engine/test/policy.test.ts"
      ],
      "commits": [],
      "review": {}
    },
    {
      "id": "audit-ledger",
      "name": "Immutable decision ledger + chain of custody",
      "family": "audit",
      "dependencies": [
        "core-types"
      ],
      "status": "DONE",
      "requirements": [
        "REQ-AUDIT-001",
        "REQ-EVIDENCE-CUSTODY-001"
      ],
      "files": [
        "packages/audit/src/index.ts"
      ],
      "tests": [
        "packages/audit/test/audit.test.ts"
      ],
      "commits": [],
      "review": {}
    },
    {
      "id": "tool-broker",
      "name": "Lease-based Tool Broker (boundary enforcement)",
      "family": "tool-broker",
      "dependencies": [
        "trust-kernel",
        "audit-ledger"
      ],
      "status": "DONE",
      "requirements": [
        "REQ-SEC-BOUNDARY-001",
        "REQ-AGENT-LEASE-001"
      ],
      "files": [
        "packages/tool-broker/src/index.ts"
      ],
      "tests": [
        "tests/safety/boundary.test.ts"
      ],
      "commits": [],
      "review": {}
    },
    {
      "id": "orchestrator",
      "name": "Unified Orchestrator (no direct agent to target)",
      "family": "orchestrator",
      "dependencies": [
        "tool-broker",
        "policy-engine"
      ],
      "status": "DONE",
      "requirements": [
        "REQ-SEC-BOUNDARY-001",
        "REQ-ORCH-001"
      ],
      "files": [
        "packages/orchestrator/src/index.ts"
      ],
      "tests": [
        "tests/safety/boundary.test.ts"
      ],
      "commits": [],
      "review": {}
    },
    {
      "id": "ai-state",
      "name": "Persistent .ai state model",
      "family": "state",
      "dependencies": [
        "repo-foundation"
      ],
      "status": "DONE",
      "requirements": [
        "REQ-STATE-001"
      ],
      "files": [
        ".ai/MASTER_STATE.json",
        ".ai/BUILD_GRAPH.json",
        ".ai/NEXT_ACTIONS.md"
      ],
      "tests": [],
      "commits": [],
      "review": {}
    },
    {
      "id": "validation-scripts",
      "name": "Policy / build-graph / state validators",
      "family": "ci",
      "dependencies": [
        "policy-engine",
        "ai-state"
      ],
      "status": "DONE",
      "requirements": [
        "REQ-CI-VALIDATE-001"
      ],
      "files": [
        "scripts/validate-policies.mjs",
        "scripts/validate-build-graph.mjs",
        "scripts/validate-state.mjs"
      ],
      "tests": [],
      "commits": [],
      "review": {}
    },
    {
      "id": "agent-registry-schema",
      "name": "Agent registry schema + validator",
      "family": "agent-org",
      "dependencies": [
        "core-types"
      ],
      "status": "DONE",
      "requirements": [
        "REQ-AGENT-REGISTRY-001"
      ],
      "files": [
        "schemas/agent.schema.json",
        "scripts/validate-agent-registry.mjs"
      ],
      "tests": [
        "tests/integration/agent-registry.test.ts"
      ],
      "commits": [],
      "review": {}
    },
    {
      "id": "agent-definitions-72",
      "name": "72 canonical agent role definitions (9 guilds x 8)",
      "family": "agent-org",
      "dependencies": [
        "agent-registry-schema"
      ],
      "status": "DONE",
      "requirements": [
        "REQ-AGENT-72-001"
      ],
      "files": [
        "agents/registry/agents.json"
      ],
      "tests": [
        "tests/integration/agent-registry.test.ts"
      ],
      "commits": [],
      "review": {}
    },
    {
      "id": "agent-role-migration-map",
      "name": "Old QA/Security roles mapped to 72 canonical agents",
      "family": "agent-org",
      "dependencies": [
        "agent-definitions-72"
      ],
      "status": "DONE",
      "requirements": [
        "REQ-AGENT-MIGRATION-001"
      ],
      "files": [
        "docs/AGENT-ROLE-MIGRATION-MAP.md"
      ],
      "tests": [],
      "commits": [],
      "review": {}
    },
    {
      "id": "knowledge-provenance-schema",
      "name": "Knowledge provenance + lifecycle schema",
      "family": "knowledge",
      "dependencies": [
        "core-types"
      ],
      "status": "DONE",
      "requirements": [
        "REQ-KNOWLEDGE-PROV-001",
        "REQ-KNOWLEDGE-LIFECYCLE-001"
      ],
      "files": [
        "schemas/knowledge-item.schema.json",
        "scripts/validate-knowledge.mjs"
      ],
      "tests": [],
      "commits": [],
      "review": {}
    },
    {
      "id": "ci-workflow",
      "name": "CI workflow (validate + typecheck + test)",
      "family": "ci",
      "dependencies": [
        "validation-scripts",
        "agent-registry-schema"
      ],
      "status": "READY",
      "requirements": [
        "REQ-CI-001"
      ],
      "files": [
        ".github/workflows/ci.yml"
      ],
      "tests": [],
      "commits": [],
      "review": {}
    },
    {
      "id": "desktop-shell",
      "name": "Desktop application shell (honest live state)",
      "family": "desktop",
      "dependencies": [
        "orchestrator",
        "ai-state"
      ],
      "status": "READY",
      "requirements": [
        "REQ-DESKTOP-001"
      ],
      "files": [
        "apps/desktop/package.json",
        "apps/desktop/src/main.ts",
        "apps/desktop/renderer/index.html"
      ],
      "tests": [],
      "commits": [],
      "review": {}
    },
    {
      "id": "github-automation",
      "name": "GitHub lifecycle automation (PR/CI/merge)",
      "family": "automation",
      "dependencies": [
        "ci-workflow"
      ],
      "status": "READY",
      "requirements": [
        "REQ-GITHUB-001"
      ],
      "files": [],
      "tests": [],
      "commits": [],
      "review": {}
    },
    {
      "id": "agent-permission-graph",
      "name": "Machine-readable least-privilege permission graph",
      "family": "agent-org",
      "dependencies": [
        "agent-definitions-72"
      ],
      "status": "DONE",
      "requirements": [
        "REQ-AGENT-PERM-001"
      ],
      "files": [
        "packages/agent-permissions/src/index.ts",
        "schemas/agent.schema.json"
      ],
      "tests": [
        "packages/agent-permissions/test/permissions.test.ts"
      ],
      "commits": [
        "0e0b4089b6c62abe3c48ff872f2b04b7950e0940"
      ],
      "review": {
        "loops": 2,
        "unresolved": {
          "P0": 0,
          "P1": 0,
          "P2": 0
        },
        "mergedPR": 1
      }
    },
    {
      "id": "skill-registry",
      "name": "Versioned skill registry",
      "family": "agent-org",
      "dependencies": [
        "agent-registry-schema"
      ],
      "status": "DONE",
      "requirements": [
        "REQ-SKILL-001"
      ],
      "files": [
        "schemas/skill.schema.json",
        "skills/registry/skills.json",
        "scripts/gen-skills.mjs",
        "scripts/validate-skill-registry.mjs"
      ],
      "tests": [
        "tests/integration/skill-registry.test.ts"
      ],
      "commits": [
        "0e0b4089b6c62abe3c48ff872f2b04b7950e0940"
      ],
      "review": {
        "loops": 2,
        "unresolved": {
          "P0": 0,
          "P1": 0,
          "P2": 0
        },
        "mergedPR": 1
      }
    },
    {
      "id": "tool-adapter-registry",
      "name": "Deterministic tool adapter registry",
      "family": "agent-org",
      "dependencies": [
        "tool-broker"
      ],
      "status": "DONE",
      "requirements": [
        "REQ-TOOL-ADAPTER-001"
      ],
      "files": [
        "schemas/tool-adapter.schema.json",
        "adapters/registry/adapters.json",
        "packages/tool-adapter-registry/src/index.ts"
      ],
      "tests": [
        "packages/tool-adapter-registry/test/adapters.test.ts"
      ],
      "commits": [
        "0e0b4089b6c62abe3c48ff872f2b04b7950e0940"
      ],
      "review": {
        "loops": 2,
        "unresolved": {
          "P0": 0,
          "P1": 0,
          "P2": 0
        },
        "mergedPR": 1
      }
    },